{
  "version": "1.0",
  "run_id": "20260813-034909-86a52eb9",
  "validated_at": "2026-08-13T04:02:43.560551Z",
  "extraction_files": [
    "state/extracts/20260813-034909-86a52eb9/targeting-official-20260813040144.json",
    "state/extracts/20260813-034909-86a52eb9/sd-official-20260813035938.json",
    "state/extracts/20260813-034909-86a52eb9/sb-official-20260813040145.json",
    "state/extracts/20260813-034909-86a52eb9/sp-official-20260813035950.json",
    "state/extracts/20260813-034909-86a52eb9/ppc-community-20260813040114.json"
  ],
  "validation_results": {
    "new": [
      {
        "fact": "Targeting defines the context in which ads appear on Amazon",
        "concept": "targeting",
        "source_id": "targeting-official",
        "source_url": "https://advertising.amazon.com/library/guides/targeting-with-sponsored-products",
        "source_type": "official",
        "quote": "Targeting is the way you define the context in which you want your ads to appear",
        "extracted_at": "2026-08-13T04:01:44.304207Z",
        "classification": "new",
        "reason": "no_match_found"
      },
      {
        "fact": "Sponsored Products offers three targeting options: Automatic, Manual, and Negative targeting",
        "concept": "targeting",
        "source_id": "targeting-official",
        "source_url": "https://advertising.amazon.com/library/guides/targeting-with-sponsored-products",
        "source_type": "official",
        "quote": "you have three targeting options \u2013 Automatic targeting Manual targeting Negative targeting",
        "extracted_at": "2026-08-13T04:01:44.304207Z",
        "classification": "new",
        "reason": "no_match_found"
      },
      {
        "fact": "Automatic targeting uses four default strategies: Close match, Loose match, Substitutes, and Complements",
        "concept": "targeting",
        "source_id": "targeting-official",
        "source_url": "https://advertising.amazon.com/library/guides/targeting-with-sponsored-products",
        "source_type": "official",
        "quote": "There are four automatic targeting strategies: Close match Loose match Substitutes Complements",
        "extracted_at": "2026-08-13T04:01:44.304207Z",
        "classification": "new",
        "reason": "no_match_found"
      },
      {
        "fact": "Close match automatic targeting shows ads to shoppers using search terms closely related to the advertised product",
        "concept": "targeting",
        "source_id": "targeting-official",
        "source_url": "https://advertising.amazon.com/library/guides/targeting-with-sponsored-products",
        "source_type": "official",
        "quote": "We may show your ad to shoppers who use search terms closely related to your products",
        "extracted_at": "2026-08-13T04:01:44.304207Z",
        "classification": "new",
        "reason": "no_match_found"
      },
      {
        "fact": "Loose match automatic targeting shows ads to shoppers using search terms loosely related to the advertised product",
        "concept": "targeting",
        "source_id": "targeting-official",
        "source_url": "https://advertising.amazon.com/library/guides/targeting-with-sponsored-products",
        "source_type": "official",
        "quote": "We may show your ad to shoppers who use search terms loosely related to your products",
        "extracted_at": "2026-08-13T04:01:44.304207Z",
        "classification": "new",
        "reason": "no_match_found"
      },
      {
        "fact": "Substitutes automatic targeting shows ads on detail pages of products similar to the advertised product",
        "concept": "targeting",
        "source_id": "targeting-official",
        "source_url": "https://advertising.amazon.com/library/guides/targeting-with-sponsored-products",
        "source_type": "official",
        "quote": "We may show your ad to shoppers browsing detail pages of products similar to yours",
        "extracted_at": "2026-08-13T04:01:44.304207Z",
        "classification": "new",
        "reason": "no_match_found"
      },
      {
        "fact": "Complements automatic targeting shows ads on detail pages of products that complement the advertised product",
        "concept": "targeting",
        "source_id": "targeting-official",
        "source_url": "https://advertising.amazon.com/library/guides/targeting-with-sponsored-products",
        "source_type": "official",
        "quote": "We may show your ad to shoppers who view the detail pages of products that complement your product",
        "extracted_at": "2026-08-13T04:01:44.304207Z",
        "classification": "new",
        "reason": "no_match_found"
      },
      {
        "fact": "Automatic targeting campaigns can set a single default bid or set bids by targeting group",
        "concept": "bidding-strategies",
        "source_id": "targeting-official",
        "source_url": "https://advertising.amazon.com/library/guides/targeting-with-sponsored-products",
        "source_type": "official",
        "quote": "You can set a single default bid in your automatic campaign, or set bids by targeting group",
        "extracted_at": "2026-08-13T04:01:44.304207Z",
        "classification": "new",
        "reason": "no_match_found"
      },
      {
        "fact": "Amazon recommends using dynamic bidding up and down for automatic targeting to maximize performance",
        "concept": "bidding-strategies",
        "source_id": "targeting-official",
        "source_url": "https://advertising.amazon.com/library/guides/targeting-with-sponsored-products",
        "source_type": "official",
        "quote": "We recommend using dynamic bidding up and down to help maximize performance",
        "extracted_at": "2026-08-13T04:01:44.304207Z",
        "classification": "new",
        "reason": "no_match_found"
      },
      {
        "fact": "Dynamic down only bidding strategy can optimize automatic targeting based on ROAS",
        "concept": "bidding-strategies",
        "source_id": "targeting-official",
        "source_url": "https://advertising.amazon.com/library/guides/targeting-with-sponsored-products",
        "source_type": "official",
        "quote": "try a dynamic down only strategy to optimize based on return on ad spend (ROAS)",
        "extracted_at": "2026-08-13T04:01:44.304207Z",
        "classification": "new",
        "reason": "no_match_found"
      },
      {
        "fact": "Amazon recommends letting automatic targeting campaigns run for about two weeks before creating manual campaigns",
        "concept": "targeting",
        "source_id": "targeting-official",
        "source_url": "https://advertising.amazon.com/library/guides/targeting-with-sponsored-products",
        "source_type": "official",
        "quote": "We recommend that you let your automatic campaign run for about two weeks before creating a manual campaign",
        "extracted_at": "2026-08-13T04:01:44.304207Z",
        "classification": "new",
        "reason": "no_match_found"
      },
      {
        "fact": "Manual targeting allows advertisers to manually select which keywords or products to target",
        "concept": "targeting",
        "source_id": "targeting-official",
        "source_url": "https://advertising.amazon.com/library/guides/targeting-with-sponsored-products",
        "source_type": "official",
        "quote": "With manual targeting, you can manually select which keywords or products you want to target",
        "extracted_at": "2026-08-13T04:01:44.304207Z",
        "classification": "new",
        "reason": "no_match_found"
      },
      {
        "fact": "Keyword targeting allows choosing specific keywords to help products appear in shopping results and on product detail pages",
        "concept": "keyword-match-types",
        "source_id": "targeting-official",
        "source_url": "https://advertising.amazon.com/library/guides/targeting-with-sponsored-products",
        "source_type": "official",
        "quote": "Keyword targeting allows you to choose specific keywords to add to your campaign",
        "extracted_at": "2026-08-13T04:01:44.304207Z",
        "classification": "new",
        "reason": "no_match_found"
      },
      {
        "fact": "Amazon provides keyword recommendations and suggested bids to help with keyword selection",
        "concept": "keyword-match-types",
        "source_id": "targeting-official",
        "source_url": "https://advertising.amazon.com/library/guides/targeting-with-sponsored-products",
        "source_type": "official",
        "quote": "we provide keyword recommendations, along with suggested bids",
        "extracted_at": "2026-08-13T04:01:44.304207Z",
        "classification": "new",
        "reason": "no_match_found"
      },
      {
        "fact": "Keyword recommendations are based on past keyword performance and search terms that translate into sales",
        "concept": "keyword-match-types",
        "source_id": "targeting-official",
        "source_url": "https://advertising.amazon.com/library/guides/targeting-with-sponsored-products",
        "source_type": "official",
        "quote": "we assess which keywords performed well for you in the past, as well as those which performed well across Amazon more broadly",
        "extracted_at": "2026-08-13T04:01:44.304207Z",
        "classification": "new",
        "reason": "no_match_found"
      },
      {
        "fact": "Keyword match types control which search terms ads will be eligible to show against",
        "concept": "keyword-match-types",
        "source_id": "targeting-official",
        "source_url": "https://advertising.amazon.com/library/guides/targeting-with-sponsored-products",
        "source_type": "official",
        "quote": "Match types are used as a way to control your targeting, helping to fine-tune which search terms your ads will be eligible to show against",
        "extracted_at": "2026-08-13T04:01:44.304207Z",
        "classification": "new",